[
  {
    "id": "stones",
    "description": "Pile ≥ 3 pierres → cairn → monument → site touristique",
    "input": { "type": "stone", "min_count": 3 },
    "conditions": [],
    "outputs": {
      "1": [ { "type": "cairn", "weight": 100, "size": [1,1] } ],
      "2": [ { "type": "monument", "weight": 100, "size": [1,1], "tags_add": ["symbolic"], "props": { "fanclub": 5 }, "contrary": "paved_cairn" } ],
      "3": [ { "type": "tourist_site", "weight": 100, "size": [3,3], "tags_add": ["symbolic"], "score": 4 } ]
    },
    "paradox_weight": 15,
    "chronicle": "CHR_CULT_01",
    "sfx": "stone_stack",
    "chapter_min": 1
  },
  {
    "id": "stones_summit",
    "description": "Pile ≥ 5 pierres en altitude → cairn → grand monument → phare néon",
    "input": { "type": "stone", "min_count": 5 },
    "conditions": [ { "fn": "altitude_min", "value": 80 } ],
    "outputs": {
      "1": [ { "type": "cairn", "weight": 100, "size": [1,1] } ],
      "2": [ { "type": "great_monument", "weight": 100, "size": [3,3], "tags_add": ["symbolic"], "props": { "fanclub": 12 } } ],
      "3": [ { "type": "neon_lighthouse", "weight": 100, "size": [3,3], "tags_add": ["symbolic"], "score": 6 } ]
    },
    "paradox_weight": 20,
    "chronicle": "CHR_CULT_01",
    "sfx": "stone_stack",
    "chapter_min": 1
  },
  {
    "id": "trench",
    "description": "Tranchée reliée près de l'eau → ruisseau → rivière → canyon",
    "input": { "type": "trench", "min_count": 3 },
    "conditions": [ { "fn": "near_water", "radius": 3 } ],
    "outputs": {
      "1": [ { "type": "brook", "weight": 100, "size": [1,1], "tags_add": ["liquid"] } ],
      "2": [ { "type": "river", "weight": 100, "size": [3,1], "tags_add": ["liquid"], "contrary": "flooded_district" } ],
      "3": [ { "type": "canyon", "weight": 100, "size": [3,1], "blocks": true, "score": 3 } ]
    },
    "paradox_weight": 25,
    "chronicle": "CHR_HOLE_01",
    "sfx": "water_flow",
    "chapter_min": 1
  },
  {
    "id": "trench_dry",
    "description": "Tranchée sans eau → fossé → fossé effondré → vallon",
    "input": { "type": "trench" },
    "conditions": [],
    "outputs": {
      "1": [ { "type": "ditch", "weight": 100, "size": [1,1] } ],
      "2": [ { "type": "collapsed_ditch", "weight": 100, "size": [1,1] } ],
      "3": [ { "type": "dale", "weight": 100, "size": [3,3], "score": 1 } ]
    },
    "paradox_weight": 10,
    "chronicle": "CHR_HOLE_01",
    "sfx": "dirt",
    "chapter_min": 1
  },
  {
    "id": "dam",
    "description": "Barrage de branches sur l'eau → étang → lac → station balnéaire",
    "input": { "type": "stick_dam", "min_count": 4 },
    "conditions": [ { "fn": "near_water", "radius": 0 } ],
    "outputs": {
      "1": [ { "type": "pond", "weight": 100, "size": [3,3], "tags_add": ["liquid"] } ],
      "2": [ { "type": "lake", "weight": 100, "size": [7,7], "tags_add": ["liquid"], "contrary": "flooded_district" } ],
      "3": [ { "type": "resort", "weight": 100, "size": [7,7], "tags_add": ["crafted", "symbolic"], "score": 5 } ]
    },
    "paradox_weight": 25,
    "chronicle": "CHR_LAKE_01",
    "sfx": "water_fill",
    "chapter_min": 1
  },
  {
    "id": "metal",
    "description": "Objet en fer → rouille → ferraille → artefact de musée",
    "input": { "type": "*", "tags_all": ["metal"] },
    "conditions": [ { "fn": "in_cave", "negate": true } ],
    "outputs": {
      "1": [ { "type": "rusty_object", "weight": 100, "size": [1,1] } ],
      "2": [ { "type": "scrap", "weight": 100, "size": [1,1] } ],
      "3": [ { "type": "museum_artifact", "weight": 100, "size": [1,1], "tags_add": ["symbolic"], "score": 2 } ]
    },
    "paradox_weight": 10,
    "chronicle": "CHR_TREASURE_01",
    "sfx": "rust",
    "chapter_min": 2
  },
  {
    "id": "metal_cave",
    "description": "Objet en fer dans la grotte → intact → intact → artefact miraculeux",
    "input": { "type": "*", "tags_all": ["metal"] },
    "conditions": [ { "fn": "in_cave" } ],
    "outputs": {
      "3": [ { "type": "miracle_artifact", "weight": 100, "size": [1,1], "tags_add": ["symbolic"], "score": 6 } ]
    },
    "paradox_weight": 10,
    "chronicle": "CHR_TREASURE_01",
    "sfx": "shine",
    "chapter_min": 2
  },
  {
    "id": "coins_buried",
    "description": "Pièces enterrées → trésor → trésor + carte → fouille archéologique",
    "input": { "type": "coins" },
    "conditions": [ { "fn": "depth_min", "value": 1 } ],
    "outputs": {
      "1": [ { "type": "treasure", "weight": 100, "size": [1,1], "tags_add": ["metal"] } ],
      "2": [ { "type": "treasure_with_map", "weight": 100, "size": [1,1], "props": { "npc_map": 1 } } ],
      "3": [ { "type": "dig_site", "weight": 100, "size": [3,3], "tags_add": ["symbolic"], "score": 4 } ]
    },
    "paradox_weight": 15,
    "chronicle": "CHR_TREASURE_01",
    "sfx": "treasure",
    "chapter_min": 2
  },
  {
    "id": "path_wear",
    "description": "Usure des passages → sentier → route → tapis roulant",
    "input": { "type": "path_cell" },
    "conditions": [ { "fn": "has_path_wear", "value": 40 } ],
    "outputs": {
      "1": [ { "type": "trail", "weight": 100, "size": [1,1] } ],
      "2": [ { "type": "paved_road", "weight": 100, "size": [1,1] } ],
      "3": [ { "type": "moving_walkway", "weight": 100, "size": [1,1], "props": { "speed_bonus": 50 }, "score": 1 } ]
    },
    "paradox_weight": 5,
    "chronicle": "CHR_PATH_01",
    "sfx": "footsteps_many",
    "chapter_min": 1
  }
]
